{
  "schemaVersion":"1.0","id":"arch.evidence.synthesizer","version":"0.1.0","name":"Evidence Synthesizer",
  "description":"Builds candidate findings from located evidence.","maturity":"stable",
  "capabilities":["evidence.synthesize_claims"],"inputs":["evidence.record_set.v1"],"outputs":["claim.candidate_set.v1"],
  "adapter":{"type":"command","command":["python3","{runtime_stub}"]},"risk":"R1",
  "permissions":{"filesystem":{"read":[],"write":["attempt:artifacts"]},"network":{"mode":"disabled","hosts":[]},"process":true,"scheduler":false,"gpu":false,"externalWrite":false,"secretHandles":[]},
  "tools":[],"evaluators":["schema.valid","claim.evidence_complete"],"budgets":{"maxWallSeconds":60,"maxToolCalls":0,"maxSources":20,"maxCostUsd":0},"routing":{"allowImplicit":true}
}
