{
  "schemaVersion":"1.0","id":"arch.research.planner","version":"0.1.0","name":"Research Planner",
  "description":"Frames objectives and measurable completion criteria.","maturity":"stable",
  "capabilities":["research.frame_objective"],"inputs":[],"outputs":["research.objective.v1"],
  "adapter":{"type":"command","command":["python3","{runtime_stub}"]},"risk":"R0",
  "permissions":{"filesystem":{"read":[],"write":["attempt:artifacts"]},"network":{"mode":"disabled","hosts":[]},"process":true,"scheduler":false,"gpu":false,"externalWrite":false,"secretHandles":[]},
  "tools":[],"evaluators":["schema.valid"],"budgets":{"maxWallSeconds":60,"maxToolCalls":0,"maxSources":0,"maxCostUsd":0},"routing":{"allowImplicit":true}
}
