{
  "schemaVersion":"1.0","id":"arch.research.hypothesis-designer","version":"0.1.0","name":"Hypothesis Designer",
  "description":"Creates falsifiable hypotheses and controls.","maturity":"stable",
  "capabilities":["research.design_hypothesis"],"inputs":["data.profile.v1"],"outputs":["research.hypothesis_set.v1"],
  "adapter":{"type":"command","command":["python3","{runtime_stub}"]},"risk":"R1",
  "permissions":{"filesystem":{"read":[],"write":["attempt:artifacts"]},"network":{"mode":"disabled","hosts":[]},"process":true,"scheduler":false,"gpu":false,"externalWrite":false,"secretHandles":[]},
  "tools":[],"evaluators":["schema.valid"],"budgets":{"maxWallSeconds":60,"maxToolCalls":0,"maxSources":0,"maxCostUsd":0},"routing":{"allowImplicit":true}
}
